{
  "receiptVersion": "egress.receipt@1",
  "receiptId": "egressrcpt_koru_hybrid_explain",
  "workspaceId": "ws_koru_studio",
  "threadId": "thr_koru_studio_main",
  "runId": "run_koru_owner_turn_mitre10",
  "mode": "hybrid",
  "provider": "openai",
  "model": "gpt-5.6",
  "purpose": "explain",
  "fieldClasses": ["aggregate_amounts", "finding_labels", "forecast_assumptions", "evidence_labels"],
  "itemCount": 9,
  "characterCount": 1024,
  "rawSourceFilesIncluded": false,
  "rawLedgerHistoryIncluded": false,
  "policyId": "policy_koru_projection_only",
  "occurredAt": "2026-07-17T08:05:00+12:00"
}
